{
  "$schema": "https://json-schema.org/draft/2020-12/schema",
  "$id": "snapshot.schema.json",
  "type": "object",
  "additionalProperties": false,
  "required": [
    "id",
    "title",
    "date",
    "description",
    "snapshot_nature",
    "geographic_scope",
    "schema_version",
    "validation_status",
    "general_cartographic_source_ids",
    "methodological_notes"
  ],
  "properties": {
    "id": {
      "const": "MAP_10"
    },
    "title": {
      "type": "string",
      "minLength": 1
    },
    "date": {
      "const": "1812-06-01"
    },
    "description": {
      "type": "string",
      "minLength": 1
    },
    "snapshot_nature": {
      "const": "historical_reconstruction"
    },
    "geographic_scope": {
      "type": "object",
      "additionalProperties": false,
      "required": [
        "name",
        "notes"
      ],
      "properties": {
        "name": {
          "type": "string"
        },
        "notes": {
          "type": "string"
        }
      }
    },
    "schema_version": {
      "const": "GBATLANTE_MAP10_1.0.1"
    },
    "validation_status": {
      "enum": [
        "draft",
        "validated_with_open_issues",
        "validated"
      ]
    },
    "general_cartographic_source_ids": {
      "type": "array",
      "minItems": 1,
      "items": {
        "type": "string",
        "pattern": "^SRC_[A-Z0-9_]+$"
      }
    },
    "methodological_notes": {
      "type": "array",
      "items": {
        "type": "string"
      }
    }
  }
}
